title,url,view,channel_name,channel_subscriber,create_stamp,mean_view,mean_comparison
一个全身上下都写着无敌的故事 | JoJo的奇妙冒险 |制裁上官 |第三集,/watch?v=ROwTNhbSrbc,198,Jc制裁上官,343,6日前,74918,0
一个放弃思考的故事 | JoJo的奇妙冒险 |制裁上官 |第二集,/watch?v=XXcBGhQBp_4,87,Jc制裁上官,343,2週間前,74918,0
一個放棄做人的故事 | JoJo的奇妙冒險 | 制裁上官 | 第一集,/watch?v=tp5qNwjUSnw,53,Jc制裁上官,343,4週間前,74918,0
Dio rejects his humanity become Kamen Rider 『JoJo Blizzard Adventure』,/watch?v=yHUZd9rdXJg,237,Jc制裁上官,343,3か月前,74918,0
The Hero is overpowered but overly cautious: Ryuuguuin Seiya All Skill,/watch?v=Rj51ClMVUmE,142,Jc制裁上官,343,7か月前,74918,0
Dr.stone ~ How to craft Glass ~ Iron~ Magnet ~ Wine,/watch?v=Eyc0w30i7hA,5302,Jc制裁上官,343,10か月前,74918,7
Kimetsu No Yaiba :Demon Slayer -11 water breath styles,/watch?v=4qhZjoP9NrM,518405,Jc制裁上官,343,11か月前,74918,692
