title,url,view,channel_name,channel_subscriber,create_stamp,mean_view,mean_comparison
Apex Legends アニメ語り合い コメント欄で話合いましょ！,/watch?v=OI9t3ZWo_nA,10,kun N,243,2か月前,96545,0
Apex Legends アニメ語り合い コメント欄で話合いましょ！,/watch?v=W_kiXT7-JPM,7,kun N,243,4か月前,96545,0
ゲームしながらアニメ語り合い配信！　コメント欄で話合いましょ！,/watch?v=dr_WgeyyGHw,21,kun N,243,6か月前,96545,0
【NARUTO】ナルトvsサスケ〜2〜 最後の戦い Naruto vs Sasuke,/watch?v=o4QlTKvFnz0,453746,kun N,243,1年前,96545,470
【NARUTO】ナルトvsサスケ〜1〜 最後の戦い Naruto vs Sasuke,/watch?v=PnYTEH1pEpA,28941,kun N,243,1年前,96545,30
