title,url,view,channel_name,channel_subscriber,create_stamp,mean_view,mean_comparison
Power Of Dog Farts,/watch?v=SNnaFEqXy0Q,163,YouTube Fil,,,756,22
Walking Around Las Vegas Be Like,/watch?v=vLBNwCF705A,72,YouTube Fil,,,756,10
It's Crazy .. Dismantling Magic Tricks,/watch?v=roVMCPI9xw4,47,YouTube Fil,,,756,6
Take Some Crazy Wedding Photo While You Still Can,/watch?v=cJi7wiaEE34,53,YouTube Fil,,,756,7
Name Of Anime Meme Songs,/watch?v=p4RrRhllIKY,14767,YouTube Fil,,,756,1953
Little Girl Surprised There Are Spiders,/watch?v=jiRbtKmXHtI,55,YouTube Fil,,,756,7
The Correct Face Mask Tutorial,/watch?v=Qo4Nk2TDZC0,188,YouTube Fil,,,756,25
Cut Down The Tree Where Your Friend Climbed,/watch?v=XwUbqLvv9zg,29,YouTube Fil,,,756,4
Michael Jackson Dove,/watch?v=-1gX_Jo2Yzs,39,YouTube Fil,,,756,5
Watch Out [ Awas ],/watch?v=y-o30-jX4wg,67,YouTube Fil,,,756,9
Try Naruto Jutsu In Public,/watch?v=IHeWUCJ04ZY,51,YouTube Fil,,,756,7
You Will Not Be Able To Stop Laughing With This Funny Dad,/watch?v=5wNpc2B1JWc,104,YouTube Fil,,,756,14
Deleted Credit Scenes In Joker [ Asian Version ],/watch?v=yldg7vMREF0,86,YouTube Fil,,,756,11
The Best Gift Ever In This World,/watch?v=C4F0UBRVJPk,16,YouTube Fil,,,756,2
Compilation Of Funny Chinese Advertisements,/watch?v=jbJ1S2ZEjfw,12,YouTube Fil,,,756,2
Amazing Photography Tricks To The Next Level Part 2,/watch?v=pIGVGUB3Rm4,34,YouTube Fil,,,756,4
When Your Life Is Full Of Bad Luck,/watch?v=7n6xZNyEKj8,12,YouTube Fil,,,756,2
We Drink Milk Equally [ Cat ],/watch?v=5RMAbgZTwA0,16,YouTube Fil,,,756,2
If I Become A Father,/watch?v=fKRwZjGGdz8,9,YouTube Fil,,,756,1
Don't Eat Doritos When Your Wife Has An Ultrasound,/watch?v=kiktHv3B2Pg,17,YouTube Fil,,,756,2
The Right Way To Kiss Your Girlfriend,/watch?v=VbYmfW34Vso,42,YouTube Fil,,,756,6
"This Guy Can Really Do Everything "" The Joker """,/watch?v=i4ocCMeuho8,33,YouTube Fil,,,756,4
If An MMA Fighters Is A Video Game Characters,/watch?v=uXEL0sTsG6Q,1141,YouTube Fil,,,756,151
How To Make A Simple Impulse Sealer,/watch?v=6yRLEGJ-KVE,8,YouTube Fil,,,756,1
Indonesian MotoGP,/watch?v=9zAlFODwpAg,12,YouTube Fil,,,756,2
God Does Not Exist?,/watch?v=_uENUpWdIec,16,YouTube Fil,,,756,2
Best Selling of Music Artists 1969 - 2019,/watch?v=Z2QU_DDIMTg,28,YouTube Fil,,,756,4
Marshmello & Anne-Marie - Friends ( Madness Dance Cover ),/watch?v=AcHpNboXhrM,38,YouTube Fil,,,756,5
This Person Made His Son A Super Hero In The Film,/watch?v=2_eUBvX4e4E,19,YouTube Fil,,,756,3
Clever Ideas For Amazing Slow Mo Videos,/watch?v=vIisbVir_tE,22942,YouTube Fil,,,756,3035
When Tom and Jerry Screenwriter Is A Music Producer,/watch?v=ZJj3ydOJG3g,42,YouTube Fil,,,756,6
Ghost Witch Prank Flying,/watch?v=qHauicMmfTk,1925,YouTube Fil,,,756,255
A Shocking Mannequin Prank,/watch?v=XuMH9zdLzww,46,YouTube Fil,,,756,6
Amazing Photography Tricks To The Next Level,/watch?v=Wd8vKLu9Bmc,109,YouTube Fil,,,756,14
"You Like Archery, This Is A Cool Archery Trick Video",/watch?v=0RnXd1qUC94,17,YouTube Fil,,,756,2
If Doors Were Made By Nokia,/watch?v=-Ox3-j5FrwA,167,YouTube Fil,,,756,22
The Most Damn Parrot In The World,/watch?v=k8MLvks7xUg,22,YouTube Fil,,,756,3
Time For Revenge,/watch?v=KEjZT-sF_nk,15,YouTube Fil,,,756,2
"Best "" Backstreet Boys - I Want It That Way "" Cover",/watch?v=WiLt_4TbVqM,45,YouTube Fil,,,756,6
When They Left Me Alone With My Niece,/watch?v=2MHq0ye5nD8,38,YouTube Fil,,,756,5
When The Weather Is Very Hot,/watch?v=1TJdcaGWD3k,23,YouTube Fil,,,756,3
"Warning!, This Video Will Make You Pain",/watch?v=-qymbx2varw,19,YouTube Fil,,,756,3
Extremely Scary Zombie Prank,/watch?v=N3kToQlMMZE,21,YouTube Fil,,,756,3
Very Scary Ghost Prank In The Elevator,/watch?v=18IPHcnZwgs,21,YouTube Fil,,,756,3
Ghost Prank On The Subway,/watch?v=XSb09cVdblM,27,YouTube Fil,,,756,4
5 Real Paranormal Activity Caught On CCTV Camera,/watch?v=K_sseRYLeMk,42,YouTube Fil,,,756,6
"When You Angry, But You Must Dance",/watch?v=aMoAz9pkrRQ,28,YouTube Fil,,,756,4
Even Ghost Can Get Scared,/watch?v=YJ-rd3kTwvI,68,YouTube Fil,,,756,9
GTA San Andreas Thug Life - Funny Moments Part 3,/watch?v=vyJIyPU0Sk4,33,YouTube Fil,,,756,4
Gamer's Life - Only Gamers Will Understand Part 3,/watch?v=fnBWLrgQX2w,27,YouTube Fil,,,756,4
Gta San Andreas Very Realistic - Thug Life,/watch?v=RrrUe67iAyk,37,YouTube Fil,,,756,5
"Best "" DJ Snake - Taki Taki ft. Selena Gomez, Ozuna, Cardi B "" Dance Cover",/watch?v=kwiCxctaxmM,30,YouTube Fil,,,756,4
GTA San Andreas Thug Life - Funny Moments Part 2,/watch?v=s2gaveoJlQQ,37,YouTube Fil,,,756,5
GTA San Andreas Thug Life - Funny Moments,/watch?v=2YHZm081_zI,28,YouTube Fil,,,756,4
Gamer's Life - Only Gamers Will Understand Part 2,/watch?v=b-zXzqkVwMU,46,YouTube Fil,,,756,6
Gamer's Life - Only Gamers Will Understand,/watch?v=NUlaq6em0yg,21,YouTube Fil,,,756,3
Funny Thug Life Gameplay Compilation,/watch?v=R_qcqkoZYzA,23,YouTube Fil,,,756,3
